,title,description,content,link,image_url,video_url,source_id,source_url,source_priority,creator,keywords,language,ai_tag,sentiment,pubDate,duplicate,coin,article_id,fetched_at,pubDateTZ,source_name,source_icon,sentiment_stats
0,Dogecoin (DOGE) Price Unaffected Despite Treasury Launch,CleanCore Solutions announced plans for a Dogecoin treasury. Dogecoin (DOGE) trades below the $0.235 horizontal resistance. Dogecoin’s price is currently attempting to break out from ...,"Key Takeaways CleanCore Solutions announced plans for a Dogecoin treasury. Dogecoin (DOGE) trades below the $0.235 horizontal resistance. Dogecoin’s price is currently attempting to break out from a wedge. On Sept. 2, CleanCore Solutions announced a $175 million move to position itself as a Dogecoin (DOGE) treasury company. Treasury strategies have become a trend this year, with most firms focusing on Bitcoin (BTC) or Ethereum (ETH) . CleanCore tried to take a different route with Dogecoin — but the market didn’t buy in. The company’s stock tumbled nearly 60% after the news, while Dogecoin’s price stayed largely unchanged. With that in mind, let’s break down DOGE’s price action and where it could be headed next. Dogecoin Price Analysis Dogecoin has been riding an ascending support trend line since October 2023, bouncing multiple times along the way — most recently in July 2025. That rebound sparked a sharp rally, breaking through a long-standing resistance line that had capped price action since the previous high. Bitcoin Ethereum Tether USD Coin XRP Dogecoin Litecoin Bitcoin Cash TRON Changelly Bitcoin Ethereum Tether Dogecoin Litecoin Bitcoin Cash TRON Binance Coin XRP Cardano Binance USD USD Coin Polkadot Shiba Inu Basic Attention Token TrueUSD Zcash Dash Dai Monero Stellar Chainlink Solana Avalanche Polygon Matic Toncoin Cosmos Wrapped Bitcoin Fantom The Sandbox Sui Cronos APEcoin Uniswap Algorand PAX Gold 1inch Network Chiliz Aave Synthetix Maker Compound SushiSwap yearn.finance Tezos NEAR Protocol Curve DAO Token Decentraland HEX Amp Axie Infinity Gala Treasure Optimism Pepe Arbitrum BitDAO The Graph Quant Lido DAO Token Ethereum Name Service Immutable Aptos Smooth Love Potion Injective Protocol Frax Share Loopring LooksRare USDD Rocket Pool GMX Kava.io WOO Network Bone ShibaSwap Synapse Frax Tether Gold Gains Network Pendle Serum Sweat Economy Euro Coin Magic Internet Money Rai Reflex Index Mantle Rollbit Coin Worldcoin MongCoin Verse Xai Bitcoin Ethereum Litecoin Tether Dogecoin USD Coin TRON EOS Taxa Token But the breakout quickly fizzled. DOGE slipped back under the key $0.235 horizontal level, which has flipped into resistance. Today, the token is trading close to where it stood before the move, raising questions about whether the breakout was a false start. Momentum signals remain indecisive. The Relative Strength Index (RSI) is exactly 50, while the Moving Average Convergence/Divergence (MACD) is near neutral at 0. That leaves the outlook murky on the weekly chart. The likeliest scenario is consolidation, with Dogecoin chopping between its long-term support at $0.180 and resistance at $0.235 until a clear trend emerges. Can Dogecoin Break Out? The shorter-term six-hour chart shows that Dogecoin completed a five-wave upward movement (green) and possibly a W-X-Y corrective structure. The corrective structure could be different, since there is no ratio between waves W and Y. Currently, the Dogecoin price is breaking out from the descending wedge, which encompasses the final portion of the upward movement. Because of the breakout, the price of Dogecoin is likely to increase to at least the 0.618 Fibonacci retracement resistance level at $0.236, which also coincides with the long-term horizontal resistance. Like the weekly time frame, the RSI and MACD are neutral. The former is at 50, while the latter is still below 0. So, a short-term increase toward resistance is likely, but the future trend remains unclear until Dogecoin closes above $0.235. Final Thoughts In conclusion, Dogecoin’s price action remains indecisive despite the breakout attempt, with consolidation between $0.180 and $0.235 appearing most likely in the short term. While the short-term wedge breakout suggests a possible move back toward resistance, momentum indicators remain neutral and do not provide a strong directional signal. A clear bullish trend will only be confirmed if DOGE manages a decisive weekly close above the $0.235 level. Crypto BEAM Rockets 30% Before Returning to Earth — Sudden Volatility Rattles Traders Crypto Curve DAO (CRV) Bottoming Out After 35% Correction — Wedge Breakout to Confirm Uptrend Crypto Bitcoin Cash (BCH) Price Tests Critical Support Zone: Here’s What’s Ahead",https://www.ccn.com/analysis/crypto/dogecoin-doge-price-treasury/,https://www.ccn.com/wp-content/uploads/2025/09/dogecoin-article-treasury-1024x576.webp,,ccnnews,https://www.ccn.com,23371.0,Valdrin Tahiri,,english,"technical analysis,liquidity",negative,2025-09-03 02:23:01+00:00,False,['DOGE'],84d7db4fd217f8eb7d0b7117e862ada6,2025-09-03 18:00:35+00:00,UTC,Ccnnewscrypto,https://n.bytvi.com/crypto/ccnnews.jpg,"{'negative': 92.09, 'neutral': 6.91, 'positive': 1.0}"
1,Somnia (SOMI) Launches Mainnet — Key Details Inside,Somnia (SOMI) launched its mainnet on Sept. 2. The launch went smoothly with only minor issues. Will the SOMI price pump or dump after launch? ...,"Key Takeaways Somnia (SOMI) launched its mainnet on Sept. 2. The launch went smoothly with only minor issues. Will the SOMI price pump or dump after launch? Somnia (SOMI) has officially launched its long-awaited mainnet, marking a significant milestone after more than 18 months of development. The rollout was smooth overall, despite a few minor hiccups that briefly disrupted activity. With exchange listings already secured, let’s analyze the SOMI price movement to see where it will go next. Somnia Mainnet Launch After 18 months of development, Somnia went live on the mainnet on Sept. 2 and immediately gained support from several large centralized exchanges, including Binance and Bitget. The network claims to have a throughput of more than one million transactions per second and a finality of less than one second, combined with low fees. Bitcoin Ethereum Tether USD Coin XRP Dogecoin Litecoin Bitcoin Cash TRON Changelly Bitcoin Ethereum Tether Dogecoin Litecoin Bitcoin Cash TRON Binance Coin XRP Cardano Binance USD USD Coin Polkadot Shiba Inu Basic Attention Token TrueUSD Zcash Dash Dai Monero Stellar Chainlink Solana Avalanche Polygon Matic Toncoin Cosmos Wrapped Bitcoin Fantom The Sandbox Sui Cronos APEcoin Uniswap Algorand PAX Gold 1inch Network Chiliz Aave Synthetix Maker Compound SushiSwap yearn.finance Tezos NEAR Protocol Curve DAO Token Decentraland HEX Amp Axie Infinity Gala Treasure Optimism Pepe Arbitrum BitDAO The Graph Quant Lido DAO Token Ethereum Name Service Immutable Aptos Smooth Love Potion Injective Protocol Frax Share Loopring LooksRare USDD Rocket Pool GMX Kava.io WOO Network Bone ShibaSwap Synapse Frax Tether Gold Gains Network Pendle Serum Sweat Economy Euro Coin Magic Internet Money Rai Reflex Index Mantle Rollbit Coin Worldcoin MongCoin Verse Xai Bitcoin Ethereum Litecoin Tether Dogecoin USD Coin TRON EOS Taxa Token Its testnet has completed over 3.5 billion transactions. Somnia aims to compete in the decentralized finance (DeFi) and gaming sectors. Its native token, SOMI, has use cases in governance, transaction fees, and validator rewards. The launch went successfully, but there were some minor issues with it. The claims page broke under heavy traffic, which also caused the Quill allocation issue. The Remote Procedure Call (RPC) was targeted by a DDoS attack, which was fixed in 30 minutes. Quickswap hit a last-minute issue, but it has been fixed since. With that in mind, let’s analyze the SOMI price action to figure out what lies ahead. SOMI Price Analysis There is insufficient price action to make a SOMI prediction, so the analysis should be taken with a grain of salt. Nevertheless, since its launch, the SOMI price has traded inside an ascending parallel channel and is currently in the channel’s lower portion. Not only do these channels usually contain corrective movements, but the fact that SOMI trades in the lower portion makes a breakdown even more likely. If that happens, the SOMI price could fall to the $0.45 horizontal support area or possibly decline to a new all-time low. This has been the case with several new Binance listings , which pump briefly after their listing but decline massively afterward. Successful Mainnet Launch While Somnia’s mainnet debut was a success, its short-term price action remains uncertain, with early indicators pointing to potential downside risk. Binance listings have previously crashed shortly after launch, and the price action suggests the same could happen to SOMI. Crypto Dogecoin (DOGE) Price Unaffected Despite Treasury Launch Crypto BEAM Rockets 30% Before Returning to Earth — Sudden Volatility Rattles Traders Crypto Curve DAO (CRV) Bottoming Out After 35% Correction — Wedge Breakout to Confirm Uptrend",https://www.ccn.com/analysis/crypto/somnia-somi-mainnet-price/,https://www.ccn.com/wp-content/uploads/2025/09/somnia-mainnet-1024x576.webp,,ccnnews,https://www.ccn.com,23371.0,Valdrin Tahiri,,english,technology,neutral,2025-09-03 03:32:15+00:00,False,,db562fc86979038fbf45d9d18ae76918,2025-09-03 18:00:34+00:00,UTC,Ccnnewscrypto,https://n.bytvi.com/crypto/ccnnews.jpg,"{'negative': 12.91, 'neutral': 72.09, 'positive': 15.0}"
2,How These 3 Privacy Protocols Are Becoming DeFi’s Next Infrastructure Layer,"The privacy conversation around decentralized finance has reached a cultural inflection point, as over 3,000 [...]","The privacy conversation around decentralized finance has reached a cultural inflection point, as over 3,000 daily conversations now flood crypto Twitter with founders , protocols , and influencers all converging on the same realization: privacy can no longer be marketed as a premium feature; it must become foundational infrastructure . Against this backdrop of collective awakening, privacy-first protocols are witnessing massive adoption as the market rushes to deliver the most elegant solutions for traders seeking to reclaim control over their on-chain activity. When Privacy Becomes a Default Expectation While the first wave of privacy protocols like Zcash and Monero attracted cypherpunks and libertarians, today’s “privacy summer” movement includes everyone from retail users to Wall Street institutions, signaling that privacy has shifted from fringe concern to mainstream necessity. The scale of this shift becomes clear in the numbers: $3.1 billion exploited from DeFi protocols in H1 2025 alone 510 million people worldwide now hold cryptocurrency as of 2025 DeFi market projected to hit $42.76 billion by 2025 , with 43.0% CAGR 14.2 million active DeFi wallets globally are processing $48 billion in weekly transaction volume 92% of Americans now worry about online privacy , with 76% demanding that companies do more Here are the privacy protocols building the infrastructure for DeFi’s anonymous future. PrivacyCash PrivacyCash represents a new generation of privacy-focused protocols, specifically designed for the Solana ecosystem. While still in development on devnet, PrivacyCash has processed over $1.1M in volume and aims to enable users to “Send SOL privately” with a focus on simplicity that could finally make privacy accessible to mainstream users. Key features: Low-Cost Privacy : Leveraging Solana’s fee structure to provide affordable privacy solutions Simplified User Experience : Making private transactions as intuitive as regular transfers for everyday users Native Solana Integration : Built specifically for Solana’s unique architecture, processing private transactions at network speeds Why it matters: By prioritising usability, PrivacyCash highlights how privacy can be normalised for mainstream users within fast-moving ecosystems like Solana. HoudiniSwap HoudiniSwap has emerged as one of the most comprehensive cross-chain privacy solutions in DeFi, processing over $1.6 billion in transaction volume while serving more than 150,000 customers who refuse to trade in the surveillance economy. Advanced capabilities: Dual-Exchange Tunneling : Exchange A handles initial funds and routes through randomized Layer 1 chains, while Exchange B completes the swap Cross-Chain Invisibility : Seamless privacy across 100+ blockchains and 4,000+ assets, making it impossible to trace fund movements Real-Time Extraction Protection : V4’s live “extraction comparison” feature shows users exactly how much they’d lose on competing platforms Why it matters: HoudiniSwap demonstrates that privacy and cross-chain liquidity can coexist at scale, enabling traders to move capital invisibly across the multichain economy. Aztec Network Aztec approaches privacy as a programmable primitive that can be embedded directly into application logic, having processed over 15,000 transactions with 20,000 full nodes running. The protocol gives developers control over what remains visible and what stays encrypted through its Noir programming language. Technical innovations: Dual-State Architecture : Supporting both public and private transactions within the same smart contract ecosystem zk-Rollup Foundation : Combining scalability improvements with privacy guarantees through encrypted batch processing Programmable Privacy : Developers implement sophisticated privacy models where specific data elements are selectively disclosed Why it matters: Aztec shifts the privacy conversation from transactional anonymity to composable application-level control, providing infrastructure for complex DeFi use cases The Next Phase of Privacy in DeFi Privacy in DeFi is no longer a niche concern but a fundamental requirement for mainstream adoption, as evidenced by the billions in volume flowing through protocols like PrivacyCash, HoudiniSwap, and Aztec, while regulatory clarity and institutional demand reshape the industry narrative. The infrastructure choices being made today will determine whether decentralised finance matures into a privacy-resilient alternative to global finance, or remains an experimental playground vulnerable to surveillance and exploitation. With institutional flows unlocking billions in capital and cultural momentum driving the narrative forward, the privacy revolution is only just beginning. The protocols laying the groundwork now are positioning themselves at the centre of DeFi’s next evolution. Share Tweet",https://ambcrypto.com/how-these-3-privacy-protocols-are-becoming-defis-next-infrastructure-layer/,https://ambcrypto.com/wp-content/uploads/2025/09/Screenshot-2025-09-03-at-2.34.20%20PM.png,,ambcrypto,https://ambcrypto.com,11604.0,AMBCrypto Team,"hidecryptopanic,press release",english,"technology,security & privacy",positive,2025-09-03 04:05:55+00:00,False,,9e11d0b3ff409d67ae43fd4b82a7d606,2025-09-03 09:15:24+00:00,UTC,Ambcrypto,https://n.bytvi.com/crypto/ambcrypto.png,"{'negative': 0.09, 'neutral': 0.96, 'positive': 98.95}"
3,Cronos (CRO) Sees 25% Drop From August High — September Rally Still Missing,"Despite CRO’s decline, a falling wedge and oversold MFI point to a bullish reversal. Active addresses have surged to the highest in three years, showing user engagement. ...","Key Takeaways Despite CRO’s decline, a falling wedge and oversold MFI point to a bullish reversal. Active addresses have surged to the highest in three years, showing user engagement. CRO could break $0.32, rally toward $0.39, and, in a strong bullish scenario, hit $0.58. After a strong run last month, Cronos (CRO) has lost momentum. The token has slipped from its August peak of $0.34 to $0.25, marking a 25% pullback. For many market watchers, August’s rally looked set to spill into September. But so far, that continuation hasn’t materialized. In this analysis, CCN reveals what’s keeping CRO stuck, and what could lie ahead for its price. Cronos Slips From August Highs Last week, CCN reported on the factors that fueled CRO’s breakout. But as of now, the trend has shifted, with the token dropping to $0.25. On the daily chart, the decline pushed the Cronos crypto into lower highs, while the Money Flow Index (MFI) slipped below 20.00 yesterday, signaling that the cryptocurrency had entered oversold territory. Bitcoin Ethereum Tether Dogecoin Litecoin Bitcoin Cash TRON Binance Coin XRP Cardano Binance USD USD Coin Polkadot Shiba Inu Basic Attention Token TrueUSD Zcash Dash Dai Monero Stellar Chainlink Solana Avalanche Polygon Matic Toncoin Cosmos Wrapped Bitcoin Fantom The Sandbox Sui Cronos APEcoin Uniswap Algorand PAX Gold 1inch Network Chiliz Aave Synthetix Maker Compound SushiSwap yearn.finance Tezos NEAR Protocol Curve DAO Token Decentraland HEX Amp Axie Infinity Gala Treasure Optimism Pepe Arbitrum BitDAO The Graph Quant Lido DAO Token Ethereum Name Service Immutable Aptos Smooth Love Potion Injective Protocol Frax Share Loopring LooksRare USDD Rocket Pool GMX Kava.io WOO Network Bone ShibaSwap Synapse Frax Tether Gold Gains Network Pendle Serum Sweat Economy Euro Coin Magic Internet Money Rai Reflex Index Mantle Rollbit Coin Worldcoin MongCoin Verse Xai Bitcoin Cash Bitcoin Ethereum Litecoin Tether XRP Dogecoin Cardano Binance Coin TRON USD Coin Solana XDC Network Uniswap THORChain Ondo Fasttoken Flare Quant Aptos Dai Worldcoin Pepe Floki Inu SushiSwap KuCoin Token 1inch Network Conflux Network Decentraland Ethereum Name Service Cosmos Chiliz Enjin Coin PAX Gold Monero Optimism Polkadot Chainlink Stellar Tezos JasmyCoin Sui Bittensor Lido DAO Token Compound Injective Protocol Maker The Graph Aave Immutable Arbitrum VeChain The Sandbox Axie Infinity Render Token Hedera Hashgraph Algorand Curve DAO Token GateToken Kava.io PayPal USD Ethena USDe Ethena Celestia JITO Lido Staked ETH Toncoin Shiba Inu Avalanche Polygon Matic Wrapped Bitcoin NEAR Protocol Ethereum Classic Helium OKB Mantle First Digital USD Bonk Sei PancakeSwap Core Trust Wallet Token MultiversX Zcash Basic Attention Token Kaspa Bitcoin Ethereum Tether USD Coin XRP Dogecoin Litecoin Bitcoin Cash TRON Changelly However, the chart also reveals a falling wedge pattern, typically a bullish reversal signal. The MFI has now broken out of that downtrend , hinting that buying momentum may return. The Awesome Oscillator (AO) adds weight to this outlook. On the chart, the AO is now flashing green histogram bars, a signal that momentum is shifting away from bearish control and tilting back toward the bulls. If this trend continues, it could further validate the falling wedge setup. In this case, CRO bulls may defend the support at $0.25, possibly retesting the overhead resistance at $0.31. On-Chain Activity Hits Multi-Year Highs From an on-chain perspective, Santiment data shows that Cronos’ active addresses have surged to 32,000 — its highest level since March 2022. A spike to multi-year highs suggests that engagement with the Cronos ecosystem is growing rapidly, indicating stronger demand for the native CRO coin. Therefore, this surge could be a tailwind for CRO’s price, especially if it coincides with technical signals hinting at a reversal from oversold conditions. In short, rising address activity gives the Cronos crypto a stronger fundamental base, potentially providing the fuel it needs to rebound from its recent dip. CRO Price at Crossroads Back on the technical side, the daily chart shows that CRO has formed a bullish pennant. This pattern signals the next leg higher after consolidation. The MACD has printed a bullish crossover, adding strength to this outlook. This suggests that momentum is shifting back in favor of buyers. If this trend holds, CRO’s price could break above the $0.32 resistance. A successful breakout would likely lead to a climb toward $0.39. In a highly bullish scenario, with strong market conditions and rising demand, the Cronos crypto could extend its rally to $0.58. On the flip side, if demand weakens and buying momentum fades, this outlook may not materialize. In that case, CRO could retreat toward $0.20, testing lower support again. You May Also Like Crypto Binance to Delist These 3 Altcoins — Prices See Doube-Digit Losses Crypto Dogecoin (DOGE) Price Unaffected Despite Treasury Launch Crypto Bitget Token (BGB) Retests $5 After Crypto Exchange Secures 440M Transfer Deal — ATH Next",https://www.ccn.com/analysis/crypto/cronos-crypto-cro-drop-aug-high-sept-rally-missing/,https://www.ccn.com/wp-content/uploads/2025/09/cronos-cro-price-recovery-september-1024x576.webp,,ccnnews,https://www.ccn.com,23371.0,Victor Olanrewaju,,english,technical analysis,negative,2025-09-03 07:32:15+00:00,False,['CRO'],2348c5c2db772ba321b3d313c41af38d,2025-09-09 09:45:43+00:00,UTC,Ccnnewscrypto,https://n.bytvi.com/crypto/ccnnews.jpg,"{'negative': 97.76, 'neutral': 1.65, 'positive': 0.59}"
